Brand,Family,Base Hardware,Edition Name,Official Name,Region,Colour,Release Date,Limited Edition,Commercial Release,Summary
Sony,PlayStation,PlayStation,Original Grey,Sony PlayStation,Worldwide,Grey,1994-12-03,No,Yes,"The Original Grey PlayStation is Sony's launch model that introduced the PlayStation brand to the world. Featuring its iconic light grey design, it established Sony as a major force in the video game industry and became one of the most influential consoles ever released."
Sony,PlayStation,PlayStation,Midnight Blue '10 Million Model',Sony PlayStation Midnight Blue 10 Million Model,Japan,Midnight Blue,1997-04,Yes,Yes,"The Midnight Blue '10 Million Model' commemorated the sale of ten million PlayStation consoles worldwide. Finished in a striking dark blue colour, it is one of the most sought-after official PlayStation collector's editions."
Sony,PlayStation,PlayStation,Video CD (SCPH-5903),Sony PlayStation Video CD,Southeast Asia,White,1995,No,Yes,"The Video CD PlayStation is a unique retail model released exclusively for Southeast Asia. It featured integrated Video CD playback, allowing the console to function as both a gaming system and a VCD player."
Sony,PlayStation,PS one,Original White,Sony PS one,Worldwide,White,2000-07-07,No,Yes,The PS one is Sony's compact redesign of the original PlayStation. It features a significantly smaller footprint while maintaining full compatibility with original PlayStation games and accessories.
Sony,PlayStation,PS one,PS one Combo Pack with LCD Screen,Sony PS one Combo Pack,Worldwide,White,2000,No,Yes,The PS one Combo Pack bundled Sony's official 5-inch LCD Screen with the compact PS one console. The combination transformed the home console into a highly portable gaming system and remains one of the most recognisable official PlayStation bundles.
